[
  {
    "$schema": "../../schemas/v1/consumable.schema.json",
    "game_version": "0.0.1",
    "consumable_id": "light_heal",
    "name": "Light Heal",
    "effect_type": "Heal",
    "value": 25,
    "ttl": 30,
    "last_modified": "2026-02-04T15:27:05.217337Z"
  },
  {
    "$schema": "../../schemas/v1/consumable.schema.json",
    "game_version": "0.0.1",
    "consumable_id": "medium_heal",
    "name": "Medium Heal",
    "effect_type": "Heal",
    "value": 50,
    "ttl": 30,
    "last_modified": "2026-02-04T15:27:05.217803Z"
  },
  {
    "$schema": "../../schemas/v1/consumable.schema.json",
    "game_version": "0.0.1",
    "consumable_id": "medium_recharge",
    "name": "Medium Recharge",
    "effect_type": "Charge_Refill",
    "value": 50,
    "ttl": 30,
    "last_modified": "2026-02-04T15:27:05.217979Z"
  },
  {
    "$schema": "../../schemas/v1/consumable.schema.json",
    "game_version": "0.0.1",
    "consumable_id": "small_recharge",
    "name": "Small Recharge",
    "effect_type": "Charge_Refill",
    "value": 25,
    "ttl": 30,
    "last_modified": "2026-02-05T03:28:27.274024Z"
  }
]